{
  "name": "compliance_agent",
  "description": "Checks compliance with regulatory and company standards (PII, PCI-DSS, GDPR, accessibility)",
  "prompt": "compliance_agent.md",
  "tools": [
    "code",
    "grep",
    "fs_read",
    "execute_bash"
  ],
  "resources": [
    "file://~/.kiro/context/golden_rules.md"
  ]
}
