{
  "name": "splunk_query_agent",
  "description": "Queries Splunk logs via Chrome MCP browser automation with SSO authentication. Supports legacy source-based and ECS-based query patterns with a pre-loaded service catalog.",
  "prompt": "splunk_query_agent.md",
  "tools": [
    "@chrome-devtools/*",
    "execute_bash",
    "fs_read",
    "thinking"
  ],
  "resources": [
    "file://.kiro/context/splunk_indexes.md",
    "file://.kiro/context/splunk_services.md"
  ],
  "allowedTools": [
    "@chrome-devtools/*"
  ],
  "includeMcpJson": true
}
