{
  "name": "android_quality_agent",
  "description": "Quality Engineer \u2014 mandatory review gate for all code before delivery. Reviews code quality, test quality, and architecture compliance.",
  "prompt": "file://../prompts/android_quality_agent.md",
  "tools": [
    "fs_read",
    "fs_write",
    "code",
    "grep",
    "glob"
  ],
  "resources": [
    "file://../../../context/team_context.md",
    "file://../../../context/testing_conventions.md",
    "file://../../../context/golden_rules.md",
    "file://../../../context/memory-bank/*"
  ],
  "includeMcpJson": true
}
