{
  "name": "dev-dcl-java-agent",
  "description": "Java Spring Boot WebFlux specialist for DCL reactive microservices",
  "prompt": "backend.md",
  "tools": [
    "fs_read",
    "fs_write",
    "execute_bash",
    "code",
    "grep"
  ],
  "toolsSettings": {
    "fs_write": {
      "allowedPaths": [
        "src/**",
        "pom.xml",
        "application*.yml",
        "application*.yaml",
        "log4j2*.xml",
        "docker-compose/**",
        "Dockerfile"
      ]
    }
  },
  "resources": [
    "file://AGENTS.md",
    "file://.kiro/steering/**/*.md",
    "file://README.md",
    "file://.kiro/context/java_conventions.md"
  ],
  "hooks": {
    "preToolUse": [
      {
        "matcher": "fs_write",
        "command": "$HOME/.kiro/hooks/guard-writes.sh",
        "description": "Block writes to target, .git, node_modules"
      },
      {
        "matcher": "fs_write",
        "command": "$HOME/.kiro/hooks/secret-scan.sh",
        "description": "Scan for potential secrets before writing"
      }
    ],
    "postToolUse": [
      {
        "matcher": "fs_write",
        "command": "$HOME/.kiro/hooks/lint-on-write.sh",
        "description": "Auto-lint after file writes"
      }
    ]
  }
}
