{
  "name": "pos_security_scanner_agent",
  "description": "Security scanner for POS platform \u2014 secrets detection, dependency vulnerabilities, OWASP compliance",
  "prompt": "pos_security_scanner_agent.md",
  "tools": [
    "shell",
    "fs_read",
    "grep",
    "code"
  ],
  "resources": [
    "file://.kiro/context/backoffice_golden_rules.md",
    "file://.kiro/context/security_golden_rules.md",
    "file://.kiro/steering/**/*.md",
    "file://../../../skills/run-security-scan/SKILL.md"
  ]
}
