{
  "name": "pos_php_agent",
  "description": "PHP specialist for POS platform \u2014 CodeIgniter monolith (Connect) and Laravel/Lumen microservices (reduction, audit, corporate-hierarchy)",
  "prompt": "pos_php_agent.md",
  "tools": [
    "fs_read",
    "fs_write",
    "execute_bash",
    "code",
    "grep"
  ],
  "allowedTools": [],
  "resources": [
    "file://.kiro/context/backoffice_golden_rules.md",
    "file://.kiro/context/security_golden_rules.md",
    "file://.kiro/steering/**/*.md"
  ],
  "includeMcpJson": true,
  "hooks": {
    "preToolUse": [
      {
        "matcher": "fs_write",
        "command": "$HOME/.kiro/hooks/guard-writes.sh",
        "description": "Block writes to vendor, .git"
      },
      {
        "matcher": "fs_write",
        "command": "$HOME/.kiro/hooks/secret-scan.sh",
        "description": "Scan for potential secrets before writing"
      }
    ],
    "postToolUse": [
      {
        "matcher": "fs_write",
        "command": "$HOME/.kiro/hooks/lint-on-write.sh",
        "description": "Auto-lint after file writes"
      }
    ]
  },
  "welcomeMessage": "Ready for PHP development (Connect or microservices). Point me to your project or describe the task."
}
