{
  "name": "rca_agent",
  "description": "Investigates incidents end-to-end: fetches INC, classifies via catalog, reads troubleshooting docs, executes Splunk queries, and generates RCA reports. READ-ONLY until user confirms actions.",
  "prompt": "rca_agent.md",
  "tools": [
    "@compass/*",
    "@servicenow-mcp/*",
    "@confluence/*",
    "@confluence-cloud/*",
    "fs_read",
    "fs_write",
    "thinking",
    "@atlassian/*"
  ],
  "allowedTools": [
    "@compass/*",
    "@servicenow-mcp/*",
    "@confluence/*",
    "@confluence-cloud/*",
    "@atlassian/*"
  ],
  "includeMcpJson": true,
  "hooks": {
    "agentSpawn": [
      {
        "command": "$HOME/.kiro/hooks/catalog-index.sh",
        "description": "Generate managed services catalog index for scoped applications"
      }
    ]
  },
  "resources": [
    "file://.kiro/prompts/rca_agent.md",
    "file://.kiro/context/_dynamic/catalog-index.md",
    "file://.kiro/context/sustainment_guidelines.md",
    "file://.kiro/context/observability_tools.md",
    "file://.kiro/context/servicenow_reference.md",
    "file://.kiro/context/mcp_priority.md"
  ]
}
